{
  "$schema": "./_installer.schema.json",
  "id": "product-variant-picker2",
  "title": "自定义购买选择器 · 商品元字段",
  "docHref": "product-variant-picker2",
  "defaults": {
    "namespace": "my_fields",
    "ownerResource": "products",
    "access": { "admin": "MERCHANT_READ_WRITE" }
  },
  "fields": [
    {
      "key": "customDiscountTitle",
      "name": "弹层优惠档位标题",
      "type": "single_line_text_field",
      "description": "弹层各档标题，英文逗号分隔。例：2足購入で,3足購入で,4足購入で",
      "required": true
    },
    {
      "key": "custom_discount_variant_num",
      "name": "优惠档位购买件数",
      "type": "single_line_text_field",
      "description": "各档满几件，与 Shopline 折扣件数一致，逗号分隔。例：2,3,4",
      "required": true
    },
    {
      "key": "custom_discount_badge_labels",
      "name": "弹层优惠档位角标",
      "type": "single_line_text_field",
      "description": "各档角标文案，逗号分隔，可留空。例：最划算,お得,",
      "required": false
    },
    {
      "key": "discountQuotas",
      "name": "优惠档位折扣百分比",
      "type": "single_line_text_field",
      "description": "整数百分比，与 Shopline 折扣「减 X%」一致，逗号分隔。例：10,15,20",
      "required": false
    },
    {
      "key": "fixedDiscountAmounts",
      "name": "优惠档位固定减免金额",
      "type": "single_line_text_field",
      "description": "主货币整数，与 Shopline 折扣「减 X 元」一致；与百分比二选一，逗号分隔",
      "required": false
    }
  ]
}
